fecha,hora,descripcion,tipo_comunicacion,persona
28/04/2025,17:15,Andrea llama a Agustín Arandia: '¿Nos vemos mañana? Quiero terminar con Antony…',llamada,Andrea Rojas
28/04/2025,19:30,Andrea recibe llamada de Antony: 'Necesitamos hablar. Ven a Honduras y República',llamada,Andrea Rojas
28/04/2025,19:50,Andrea llama a Agustín Arandia: 'Mañana sí podemos vernos. Antony quiere hablar hoy…',llamada,Andrea Rojas
28/04/2025,20:20,Andrea llama a Fernanda Cossío: 'Creo que Antony sabe lo de Agustín…',llamada,Andrea Rojas
28/04/2025,20:45,Andrea llama a Agustín Arandia: 'Debes dejar a Samantha. Yo dejaré a Antony',llamada,Andrea Rojas
28/04/2025,20:55,Andrea llama a Antony: 'Ya casi llego. ¿Estás en la esquina?',llamada,Andrea Rojas
