Date-Time,Source,Destination,Event Type
2025-04-27 19:30,Fexpocruz,Andrea,Necesitamos hablar. Es urgente
2025-04-27 20:00,Calle Tunari/Av. Los Andes,Raúl Villarroel,¿Qué hago si la mato? ¡Me destruyó!
2025-04-27 20:20,Calle Jorochito,Jonatan Jaldín,No aguanto esta traición
2025-04-27 20:45,25 de Mayo/Calle Punata,Andrea,¿Ya estás cerca?
2025-04-27 21:30,Av. Huayna Cápac/Aroma,José Orellana,¡Necesito ayuda! ¡Ven al río Rocha!
2025-04-27 21:55,Av. Heroínas/Juana Azurduy,Patricio Rocha,Tráeme bolsa negra y watos. ¡Urgente!
